{
  "$schema": "https://raw.githubusercontent.com/patrickkabwe/create-nitro-module/refs/heads/main/assets/nitro-schema.json",
  "cxxNamespace": ["$$cxxNamespace$$"],
  "ios": {
    "iosModuleName": "$$iosModuleName$$"
  },
  "android": {
    "androidNamespace": ["$$androidNamespace$$"],
    "androidCxxLibName": "$$androidCxxLibName$$"
  },
  "autolinking": {},
  "ignorePaths": ["node_modules"]
}
